{"contract_version":"patent-research.v2","artifact_type":"WeakSignalRegister","report_label":"专利弱信号候选","corpus_id":"sha256:0000000000000000000000000000000000000000000000000000000000000000","cutoff":"2026-07-17","signals":[{"signal_id":"signal-1","candidate":"staged hydrogen claim pattern","novelty_within_corpus":"high","evidence_strength":"low","supporting_evidence_ids":["sha256:1111111111111111111111111111111111111111111111111111111111111111"],"contradictory_evidence_ids":[],"alternative_explanations":["single-document noise"],"falsification_condition":"No independent recurrence by the review horizon.","monitoring_trigger":"Independent applicant publishes the same mechanism.","review_horizon":"2027-07-17"}],"limitations":["fixture only"],"search_gap_requests":[]}
